Utterance,Speaker,Emotion,Sentiment,Dialogue_ID,Generate_emotion,tips
I don?t know if you?d understand.,Joey,neutral,neutral,10,neutral,"The emotion of doubt in the current utterance may be due to Joey feeling uncertain about the listener's ability to comprehend a complex topic. This doubt could stem from Joey's previous comment about their differing perspectives, leading to a sense of disconnect or misunderstanding."
"Yeah, none of us have to deal with pressure at our jobs.",Ross,neutral,neutral,10,neutral,"The reason for Joey's emotion of uncertainty may be due to feeling misunderstood or underestimated by Ross, who claims that none of them have to deal with pressure at their jobs. Joey may feel the need to explain or defend the pressure he faces in his own job."
"Well Phoebe, we gotta do something!",Rachel,sadness,negative,11,anger,"Reason for the emotion of anger: Rachel's emotion of anger may be driven by a sense of urgency and frustration in trying to find a solution to a problem, leading her to express her feelings to Phoebe."
I mean there?s no way Joey?s gonna make it in time.,Rachel,fear,negative,11,neutral,"The reason for the neutral emotion in this situation could be due to the uncertainty and doubt expressed by the speaker about Joey making it in time. The listener may react by trying to come up with a plan or offering reassurance, which could help alleviate the speaker's concerns and potentially change their emotion."
So I?m gonna go through the hotel and see if there?s any other weddings going on.,Rachel,neutral,neutral,11,neutral,"The emotion of neutrality in this context may be due to the speaker simply stating their plan to check for other weddings at the hotel without any strong emotional attachment. The intention is to gather information, and the reaction from the listener may be neutral or curious, which aligns with the speaker's neutral emotion."
Okay. Oh but don?t tell them Monica?s pregnant because they frown on that.,Phoebe,neutral,neutral,11,neutral,"The emotion of neutrality in the utterance may be due to the speaker simply relaying information without any strong feelings attached to it. The intention to not tell others about Monica's pregnancy and the listener's potential curiosity about other weddings may not evoke a strong emotional response, leading to a neutral tone."
Okay.,Rachel,neutral,neutral,11,neutral,The reason for Phoebe's emotion of caution could be to protect Monica's privacy and avoid any potential negative consequences that may arise from revealing her pregnancy.
"What?s all this about you guys fighting?! Is this really over a room?! I mean, that is so silly!",Ross,anger,negative,12,anger,"The emotion of anger in Ross is likely due to his disbelief and frustration over the situation, as well as his perception that the fight over a room is silly."
"Ross, we can handle this.",Monica,neutral,neutral,12,neutral,The emotion of disbelief and confusion in the preUtterance may be caused by the speaker's perception that the situation is trivial and not worth fighting over.
"Well, apparently not, and I can?t just stand by and watch two people I care about very much be hurt over something that is so silly.",Ross,sadness,negative,12,sadness,Ross is feeling sadness because he cares deeply about the well-being of the people involved and doesn't want to see them hurt over something he perceives as trivial. This emotion may stem from a sense of helplessness in wanting to protect his loved ones from unnecessary pain.
"I mean, enough of the silliness!",Ross,anger,negative,12,anger,The reason for Ross's anger in this situation could be his frustration with the silliness of the situation causing harm to people he cares about.
"Well, why don?t you tell her to stop being silly!",Chandler,anger,negative,12,anger,The reason for the anger emotion in Chandler could be due to his frustration with the other person's behavior and his desire for them to stop being silly.
Okay-okay!,Ross,anger,negative,12,anger,"The reason for Ross's anger could be due to feeling frustrated or overwhelmed with the situation he is dealing with. Chandler's suggestion to tell the other person to stop being silly may not be helpful or address the root of Ross's frustration, leading to his emotional response."
"Two very good points, look I?ve known you both a long time, and I?ve never seen either of you one/millionth as happy as you?ve been since you?ve got together.",Ross,sadness,negative,12,joy,"The reason for the emotion of joy in this situation is likely due to the speaker expressing genuine happiness and support for the listener's relationship, which can make the listener feel grateful and touched."
Do you really want to throw that all away over a room?,Ross,sadness,negative,12,neutral,"The emotion of neutrality in the current utterance may be due to Ross trying to appeal to reason and logic in the situation, rather than expressing strong emotions. He is trying to make the listener reconsider their decision by pointing out the happiness they have experienced together."
That is so silly.,Ross,joy,positive,12,anger,"The reason for Ross's anger in the current utterance may be due to feeling frustrated or incredulous about the listener's actions, possibly feeling like their decision is irrational or unnecessary."
"Now wh-what is more important, love or silliness?",Ross,neutral,neutral,12,neutral,"The emotion of neutrality in Ross's question about the importance of love or silliness may indicate a contemplative or curious mindset, as he is pondering the value of these two elements in relationships. His intention could be to spark a thought-provoking conversation or to explore the dynamics of love and humor in a relationship. The listener may perceive his question as thought-provoking and may offer their own perspective on the topic."
"Well, we are fond of the silliness, but we also have a soft spot for the love.",Chandler,neutral,neutral,12,neutral,"The emotion of neutrality in Chandler's utterance may be due to his balanced view on the importance of love and silliness. He acknowledges both aspects without showing a strong preference for one over the other, which could lead to a more open and inclusive conversation with Ross."
Love is the best medicine.,Monica,joy,positive,12,joy,"The reason for the emotion of joy in Monica's utterance could be due to her belief in the power of love as a positive force in relationships, which is reflected in her statement. Additionally, Chandler's previous comment about having a soft spot for love may have reinforced Monica's feelings of joy and validation in expressing her belief."
That?s laughter.,Chandler,joy,positive,12,joy,"The reason for the emotion of joy in Chandler's utterance could be due to the positive impact of laughter on one's well-being, as mentioned in Monica's preUtterance about love being the best medicine. Chandler may be feeling joy because he agrees with the sentiment that laughter is beneficial and important in life."
Why do you do it?,Monica,neutral,neutral,12,neutral,"The emotion of the current utterance ""neutral"" suggests that Monica is curious or seeking clarification about the listener's actions. She may be trying to understand the motivation behind their behavior."
I don?t know.,Chandler,neutral,neutral,12,neutral,The emotion of neutrality in Chandler's utterance may be due to his uncertainty or lack of knowledge about the situation. This could lead to a neutral response as he is unsure of how to proceed or what to say.
"Okay! All right! Now, Chandler you-you wanna live with Monica, right?",Ross,neutral,neutral,12,neutral,"Chandler's uncertainty may be due to the fact that he is unsure about making a big decision like living with Monica, or he may have reservations about the idea for personal reasons."
"Yeah, I do.",Chandler,neutral,neutral,12,joy,"The reason for Chandler's joy could be that he is happy and excited about the prospect of living with Monica, as confirmed by Ross' question."
"And Mon, you wanna live with Chandler, don?t ya?",Ross,neutral,neutral,12,joy,The emotion of joy in Ross may be due to the excitement of potentially living with Chandler and the positive dynamic between them.
Yes.,Monica,neutral,neutral,12,joy,"The reason for Monica's joy could be that she is excited and happy about the prospect of living with Chandler, as confirmed by Ross's question."
Good! A verbal contract is binding in the state of New York!,Ross,joy,positive,12,joy,"The reason for Ross's joy could be that he is happy to confirm that a verbal contract is binding in the state of New York, which aligns with his intention to assert the validity of their agreement. Monica's simple agreement in the preUtterance may have also contributed to Ross's joy."
Oh.,Roger,neutral,neutral,13,neutral,The speaker's neutral emotion could be due to a lack of interest or engagement in the conversation. The listener may react by feeling unsure or indifferent about the topic at hand.
"But I don't. Me, Phoebe.",Phoebe,neutral,neutral,13,neutral,"The emotion of surprise or uncertainty in Roger may be due to Phoebe's unexpected statement that she doesn't have something, which may have caught him off guard and left him unsure of how to respond."
"Well, I'm not I'm not at all surprised they feel that way.",Roger,neutral,neutral,13,surprise,The emotion of surprise in the current utterance may be due to the speaker Roger not expecting the feelings expressed by the previous speaker. This could lead to further questioning or discussion to understand the differing perspectives.
"You're not? See, that's why you're so great!",Phoebe,surprise,positive,13,joy,"The reason for Phoebe's joy could be that she feels validated and appreciated by Roger's response, which reinforces her positive feelings about herself."
"Actually it's, it's quite, y'know, typical behaviour when you have this kind of dysfunctional group dynamic.",Roger,neutral,neutral,13,neutral,"The emotion of neutrality in the current utterance may be due to the speaker's analytical tone in explaining the dysfunctional group dynamic, which may not necessarily evoke strong emotions. The listener's potential agreement or understanding reaction also contributes to the overall neutral tone of the conversation."
"Y'know, this kind of co-dependant, emotionally stunted, sitting in your stupid coffee house with your stupid big cups which, I'm sorry, might as well have nipples on them, and you're like all 'Oh, define me!",Roger,anger,negative,13,anger,The emotion of anger in the current utterance may be a result of the speaker feeling frustrated or irritated by the behavior of the individuals in the coffee house and their dysfunctional group dynamic. The speaker's intention to criticize and the potential defensive or offended reaction from the listener could contribute to this feeling of anger.
Define me!,Roger,anger,negative,13,joy,"The emotion of joy in the current utterance may be a result of the speaker finding humor or amusement in the situation they are describing. The speaker's sarcastic and exaggerated tone in the preUtterance suggests they are making fun of the listener's behavior, which could be seen as comical to them."
"Love me, I need love!",Roger,anger,negative,13,joy,"The emotion of joy in the current utterance ""Love me, I need love!"" may be driven by the speaker's desire for validation, reassurance, or affection from the listener. The listener's potential reaction of providing affection or support could contribute to the speaker's feelings of joy."
Have you really done this before?,Phoebe,surprise,positive,14,surprise,"The emotion of surprise in Phoebe's utterance may be due to her skepticism about the listener's experience, leading her to question if they have actually done something before. This could cause the listener to feel challenged or defensive, as they may need to prove their credibility or expertise in the situation."
Yeah!,Joey,joy,positive,14,joy,"The reason for the emotion of joy in Joey's utterance could be due to his excitement or pride in confirming his previous experience, as indicated by his intention. The listener's possible reaction of surprise or curiosity may also contribute to Joey's joy in the interaction."
Yeah!,Joey,joy,positive,14,joy,"Reason for emotion: The speaker is likely feeling joy or excitement because they are expressing agreement or enthusiasm, and the listener is likely sharing in that joy or agreement."
Yeah!,Joey,joy,positive,14,joy,"The reason for Joey's joy in the utterance ""Yeah!"" could be due to excitement or happiness about a certain topic or situation. This is supported by the listener's possible reaction of sharing in that joy or responding with excitement in the preUtterance."
"You just take a big, big swing.",Joey,neutral,neutral,14,joy,"The reason for the joy emotion in the current utterance is likely due to the speaker's intention to encourage and excite the listener, leading to a positive and enthusiastic reaction from the listener."
"Now, don?t hold back.",Joey,neutral,neutral,14,joy,The reason for the emotion of joy in the current utterance is likely because the speaker's intention of encouraging the listener to not hold back and give their all is motivating and exciting. This positive reinforcement can lead to a feeling of joy in the listener.
Hey!,Phoebe,joy,positive,14,joy,"The reason for Phoebe's joy could be that she feels welcomed and encouraged by Joey's statement to not hold back, allowing her to express herself freely and openly."
Hey-hey-hey!,Joey,joy,positive,14,joy,"The reason for the emotion of joy in the current utterance ""Hey-hey-hey!"" could be the speaker's excitement and enthusiasm in greeting the listener, which may lead to a positive and energetic interaction with the listener."
What are you doing?,Chandler,neutral,neutral,14,neutral,"The neutral emotion in Chandler's response ""What are you doing?"" may be due to curiosity or confusion about Joey's behavior, as he is likely trying to understand the reason behind Joey's greeting."
We?re just celebrating that Joey got his health insurance back.,Phoebe,joy,positive,14,joy,"The reason for the emotion of joy in Phoebe could be due to celebrating Joey getting his health insurance back, which is a positive and relieving event for them."
"Oh, all right.",Chandler,neutral,neutral,14,neutral,"The reason for the neutral emotion could be that Chandler is resigned to the situation and accepting of it, as indicated by his response."
"Yeah! Sure! Yep!  Oh, y'know what? If I heard a shot right now, I'd throw my body on you.",Phoebe,joy,positive,15,joy,"The reason for the emotion of joy in the current utterance is likely due to the speaker's playful and humorous intention to express excitement, which may lead the listener to react with laughter or amusement."
Oh yeah? Well maybe you and I should take a walk through a bad neighborhood.,Gary,joy,positive,15,anger,The emotion of anger in the current utterance may be fueled by the speaker's attempt to provoke or intimidate the listener by suggesting a walk through a bad neighborhood. The listener's reaction of nervously offering to protect the speaker in case of danger could further escalate the speaker's anger.
Okay!,Phoebe,joy,positive,15,joy,The emotion of joy in Phoebe's utterance may be due to her excitement or enthusiasm about the suggestion being made.
Bye!,Phoebe,neutral,neutral,15,joy,"The emotion of joy in the utterance ""Bye!"" could be due to the speaker feeling happy or satisfied with the interaction, while the listener's acknowledgment or acceptance in response to ""Okay!"" may have contributed to this positive emotion."
Bye!,Joey,neutral,neutral,15,joy,"The reason for Joey's joy could be that he felt acknowledged and appreciated by Phoebe's reciprocal farewell, leading to a positive emotional response."
Cut it out Ross! I hate to have to save your life and kick your ass in the same day!,Joey,anger,negative,15,anger,The reason for Joey's anger in this situation could be due to feeling overwhelmed or frustrated by having to constantly save Ross and deal with his antics. This could lead to Joey expressing his frustration through anger in this current utterance.
"Hey, Joey, could you pass the cheese?",Monica,neutral,neutral,16,neutral,"Reason for the neutral emotion: The speaker's request for passing the cheese is a simple and common interaction, which may not evoke strong emotions. The listener's expected reaction of passing the cheese is a typical response in this situation, leading to a neutral emotional response from the speaker."
"Listen uh, I?d prefer it if you didn?t call me Joey.",Joey,neutral,neutral,16,anger,"The reason for Joey's anger could be that he has expressed a preference not to be called Joey, but Monica continues to do so, possibly disregarding his feelings or boundaries."
"Since I don?t know anyone here, I thought it?d be cool to try out a cool work nickname.",Joey,neutral,neutral,16,neutral,The emotion of neutrality in the current utterance could be due to the speaker trying to navigate a new social environment and establish boundaries without causing conflict. The speaker may be open to trying out a new work nickname but also wants to assert their preference for what they are called.
"Hey, dragon! Here?s your tips from Monday and Tuesday.",A Waiter,neutral,neutral,16,joy,"The emotion of joy in the waiter could be due to the positive and friendly interaction with Joey, as well as the feeling of camaraderie and connection that comes from giving a work nickname."
There?s like-there?s like 300 bucks in this one!,Joey,surprise,negative,16,surprise,The reason for the emotion of surprise in this context is likely due to the unexpected amount of money (300 bucks) that Joey found in the tip. The speaker's intention to inform Joey about the tip amount and Joey's possible reaction of surprise or excitement contribute to this feeling of surprise.
"Yeah, people get pretty generous around the holidays. And it never hurts to wear tight trousers.",The Waiter,neutral,neutral,16,joy,"The reason for the emotion of joy in this conversation is likely due to the surprise and excitement expressed by the speaker at the generous tip, which could lead to a positive and grateful reaction from the listener."
Could the waiters gather around to hear tonight?s specials?,Monica,neutral,neutral,16,neutral,"The emotion of the speaker in the preUtterance may be humor or light-heartedness, as they are making a playful comment about wearing tight trousers. This could lead to a positive reaction from the listener, such as amusement or agreement, contributing to the overall light and friendly atmosphere of the conversation."
"Okay, first there is a Chilean Sea Bass prepared with a Mango relish on a bag?Why is nobody writing these down?",Monica,neutral,neutral,16,surprise,"The reason for the surprise emotion could be that Monica is surprised that nobody is writing down the specials she is announcing, despite her clear intention for the waiters to do so."
Because we can remember them.,The Waiter,neutral,neutral,16,joy,"The reason for the emotion of frustration or annoyance in the speaker may be due to the concern that their order may be incorrect or forgotten by the waiter, as indicated by the listener's confusion or concern in their reaction."
Because your all gonna make up fake specials and make me cook them like you did the other night?,Monica,anger,negative,16,anger,"The reason for Monica's anger could be due to feeling manipulated or taken advantage of by the others, as indicated by her accusation of them making up fake specials and forcing her to cook them."
Hey. When you guys were kids and you played,Ross,neutral,neutral,17,neutral,The emotion of curiosity in Ross may stem from a desire to connect with his friends on a nostalgic level and possibly bond over shared childhood memories. This curiosity could lead to a conversation filled with reminiscing and storytelling among the group.
I was always Joanne.,Monica,neutral,neutral,17,neutral,"The reason for Monica's neutral emotion could be that she is reflecting on her childhood identity as Joanne, which may not necessarily evoke strong positive or negative feelings."
"Question. Was ah, ?Egg the Gellers!? the war cry of your neighbourhood?",Joey,neutral,neutral,17,joy,"The emotion of joy in this conversation may be due to the speaker reminiscing about a funny memory from their childhood neighborhood, and the listener's potential reaction of laughter or sharing similar memories adds to the joyful atmosphere."
Ewww! Oh! It?s the Mattress King!,Phoebe,disgust,negative,17,disgust,"The emotion of disgust in Phoebe's utterance may be due to her reaction to the Mattress King, possibly indicating that she finds him repulsive or unpleasant. This could be influenced by her intention to express her distaste humorously, leading to a possible reaction of amusement or agreement from the listener."
Don?t look honey. Change the channel! Change the channel!,Chandler,disgust,negative,17,joy,The emotion of joy in Chandler's utterance is likely due to the humor in the situation of trying to avoid seeing something unpleasant on TV and the urgency in his request to change the channel.
"Wait! Wait! I wanna see this. After I divorce him, half of that kingdom is gonna be mine.",Janice,joy,positive,17,joy,"The emotion of joy in Janice's utterance could be due to her anticipation of gaining wealth and power through a divorce settlement. Her intention to claim half of the kingdom suggests a desire for financial independence and a sense of empowerment. The reaction of Chandler in the preUtterance, trying to divert Janice's attention, may contribute to Janice's joy as she sees herself as taking control of her own destiny."
What a wank!,Chandler,anger,negative,17,anger,"The reason for Chandler's anger may be due to feeling frustrated or annoyed by the situation or person being discussed, as indicated by his statement ""What a wank!"" and the context of the conversation with Janice."
"Oh, I cannot believe he?s using our divorce to sell mattresses.",Janice,anger,negative,17,anger,"The reason for the emotion of anger in this situation is likely due to feeling betrayed or disrespected by the ex-partner's actions of using the divorce to sell mattresses. The speaker may feel hurt, frustrated, and possibly humiliated by this exploitation of their personal situation for financial gain."
I know!,Monica,anger,negative,17,anger,The speaker's anger may be fueled by feeling exploited or disrespected by someone using their personal life for commercial gain. The listener may respond with empathy or validation of the speaker's feelings of betrayal or invasion of privacy.
"And four ninety-nine for a pillow top queen set, who cares about the divorce, those babies will sell themselves.",Monica,anger,negative,17,joy,The reason for the joy emotion in this utterance could be attributed to the speaker's excitement and enthusiasm about the affordable price of the pillow top queen set. The positive reaction from the listener may have also contributed to the speaker feeling joyful.
And I?m appalled for you by the way.,Monica,anger,negative,17,anger,The speaker's anger may be due to feeling appalled for the listener and possibly feeling frustrated by their lack of empathy towards the listener's situation.
"You had to do it, didn?t you? You couldn?t just leave it alone.",Rachel,sadness,negative,17,sadness,The sadness in Rachel's emotion may be due to feeling disappointed in the listener's actions and possibly feeling regretful or frustrated that they couldn't resist getting involved.
Four percent. Okay. I tip more than that when there?s a bug in my food.,Ross,disgust,negative,17,disgust,"The emotion of disgust in Ross's utterance may be due to his frustration with the low tip percentage mentioned, which could also contribute to the listener's possible annoyance or resignation in response to Rachel's comment."
"Ross, tonight was about the two of you getting along.  Oh, would you just see my chiropractor, already.",Rachel,anger,negative,17,anger,"The reason for Rachel's anger towards Ross may be due to her frustration with his unwillingness to see her chiropractor, despite her efforts to encourage him to do so for the sake of their relationship."
"Yeah, I?m gonna go to a doctor who went to school in a mini-mall.",Ross,disgust,negative,17,neutral,The emotion of neutrality in Ross's statement may be due to his nonchalant attitude towards seeking medical help and his preference for a doctor from an unconventional location. His intention to go to a doctor in a mini-mall may indicate a lack of concern for traditional medical practices.
"Hey Pheebs, what are you doing?",Ross,neutral,neutral,17,neutral,"The emotion of neutral in Ross's current utterance could be due to the casual nature of his question to Phoebe about what she is doing. It seems like a simple, everyday conversation without any strong emotions attached."
"I?m, I?m freaking out!",Phoebe,fear,negative,17,fear,"The reason for Phoebe's fear could be due to a stressful or overwhelming situation she is facing, which may be causing her to freak out. Ross's intention to ask what she is doing could be to show concern and offer support, which may prompt Phoebe to seek comfort or explanation from him."
Monica kinda trusted me with something and she shouldn?t have!,Phoebe,fear,negative,17,surprise,"The speaker is likely feeling anxious or worried because they are ""freaking out"" about something, and the listener may respond with concern or reassurance to help alleviate their distress."
