Utterance,Speaker,Emotion,Sentiment,Dialogue_ID,Generate_emotion,tips
We're here!,Ross,joy,positive,35,joy,"The reason for the emotion of joy in Ross could be due to the successful completion of a task or goal, as indicated by the encouragement and support from the group to keep pushing forward."
Where have you been?,Carol,neutral,neutral,35,neutral,"The emotion of neutrality in Carol's question ""Where have you been?"" may suggest she is simply seeking information without any strong emotional attachment. It could be a neutral inquiry about the speaker's whereabouts."
"Long story, honey.",Ross,neutral,neutral,35,neutral,"The emotion of neutrality in Ross's response ""Long story, honey"" could indicate that he is trying to avoid sharing details or downplaying the situation to Carol. This could be because he doesn't want to get into a potentially complicated or uncomfortable conversation with her."
"All right, Carol, I need you to keep pushing. I need? Excuse me, could I have this?",Dr. Franzblau,neutral,neutral,35,surprise,"The surprise emotion may be due to the unexpected request or interruption from Dr. Franzblau, causing a shift in the conversation and catching Carol off guard."
C'mon up.,Rachel,neutral,neutral,36,neutral,The emotion of neutrality in this context may suggest that the speaker is simply making a casual invitation without any strong emotions attached. The listener's expected reaction of accepting the invitation may also contribute to the neutral tone of the speaker.
Behind my brother's back?  ... is exactly the kind of crazy thing you won't be hearing from me.,Monica,anger,negative,36,anger,"The reason for Monica's anger could be due to the suggestion of doing something sneaky or dishonest behind her brother's back, which goes against her values and principles."
"So, I hear, you hate me!",Janice,anger,negative,37,anger,"Reason for anger: The speaker may feel anger because they are confronting the listener about their negative feelings towards them, which could be hurtful or unexpected."
"I, ah, I never said hate, I was very careful about that.",Joey,neutral,neutral,37,neutral,The reason for the neutral emotion in this situation could be that Joey is being careful with his words and trying to clarify that he never explicitly said he hates Janice. This may indicate a desire to avoid conflict or misunderstanding.
A little birdie told me something about you wanting to rip your arm off and throw it at me.,Janice,anger,negative,37,anger,"The speaker's anger may be fueled by feeling accused or threatened by the listener's previous statement, leading them to react defensively and assertively."
And you got a 'hate' from that?! Your taking a big leap there...,Joey,fear,negative,37,anger,"The emotion of anger in this context may be triggered by the speaker's sarcastic or mocking comment, which could be seen as provocative or insulting by the listener."
"All right, fine, fine, fine, fine, fine, we've got to do something about our little situation here Joey.",Janice,anger,negative,37,anger,"The emotion of anger in Janice's utterance may be due to frustration or impatience with the situation, as well as a sense of urgency to address the issue with Joey."
"So, this is my idea: you and me spending some quality time together.",Janice,neutral,neutral,37,joy,"The reason for the emotion of frustration or exasperation in the speaker could be due to feeling the need to address and resolve a situation or problem with the listener, as indicated by their statement in the preUtterance."
But what does that gonna do...,Joey,anger,negative,37,anger,The emotion of anger in Joey's utterance could be due to frustration or annoyance at not understanding the purpose or benefit of the suggested plan by Janice.
For Chandler!,Janice,anger,negative,37,anger,"The reason for Janice's anger could be her frustration with Joey's question and her strong support for Chandler. She may feel the need to defend Chandler and express her loyalty to him, leading to her emotional outburst."
"Guess what, I got an audition!",Student,joy,positive,38,surprise,"The reason for the surprise emotion could be because the speaker was not expecting to get an audition, and the listener's possible reaction of congratulating or expressing excitement could have contributed to the surprise."
"Awww, one of my students got an audition. I?m so proud.",Joey,joy,positive,38,joy,"The reason for the emotion of joy in this situation is likely due to the speaker feeling proud and happy for their student's achievement, and the listener sharing in that joy and excitement."
I was wondering if you would consider coaching me for it?,Student,neutral,neutral,38,joy,"The emotion of joy in the current utterance may be due to the student seeking coaching from the listener, which shows a willingness to improve and succeed, leading to a positive response from the listener."
You bet! What?s the part?,Joey,joy,positive,38,joy,"The reason for Joey's joy could be because he is excited and willing to help with whatever the part is, which aligns with the speaker's intention of asking for coaching and the listener's possible willingness to help."
"Oh it?s great, it?s a role on",Student,joy,positive,38,joy,The reason for the speaker's joy could be because they are excited about the role they have been given and feel supported by the listener's positive reaction.
"Hi!  Hi!  Hi. Has umm, anyone seen Chandler?",Ross,neutral,neutral,39,joy,"The reason for Ross's joy could be that he is happy and excited to see Chandler, and his intention to find him may be driven by a positive and friendly motive. The listener's reaction of curiosity or interest in helping Ross locate Chandler may also contribute to Ross's joyful emotion."
I thought he was with you.,Mr. Geller,neutral,neutral,39,neutral,"The emotion of concern in Mr. Geller's statement ""I thought he was with you"" is likely due to the fact that Chandler is missing and there is uncertainty about his whereabouts. This uncertainty may lead to a sense of worry or unease, prompting Mr. Geller to express his concern and seek information from the listener."
"He-he was with me umm, we?re playing a little game, y?know? Hide and seek.",Ross,neutral,neutral,39,neutral,The reason for Mr. Geller's confusion or suspicion could be due to the fact that Ross's explanation of playing hide and seek seems questionable or inconsistent with the situation.
"You can?t ask us son, that?s cheating.",Mr. Geller,neutral,neutral,39,neutral,The emotion of neutrality in Mr. Geller may be due to his attempt to maintain a sense of fairness by not wanting to cheat in the game. His intention to uphold honesty may lead to a reaction of surprise or respect from the listener.
"You?re right, thanks for keeping me honest dad.",Ross,neutral,neutral,39,neutral,"The emotion of neutrality in Ross's utterance could be due to his acknowledgment of being corrected by his dad and appreciating the honesty. His intention was to thank his dad for keeping him honest, and the listener's possible reaction could be understanding and acceptance of the correction."
"Well, he better not come by here. He can?t see the bride in the wedding dress.",Mrs. Geller,neutral,neutral,39,fear,The emotion of fear in Mrs. Geller may be due to her concern for the bride's well-being and wanting to protect her from any potential negative interactions with someone she does not want to see.
"As I recall when we got married, I saw the groom in the wedding dress.",Mrs. Bing,joy,positive,39,joy,"The reason for the joy in Mrs. Bing's emotion could be due to the fond memory of seeing the groom in the wedding dress during their own wedding, which likely brings back happy and nostalgic feelings."
"But that was after the wedding, it?s not bad luck then.",Mr. Bing,neutral,neutral,39,neutral,"The emotion of neutral in the current utterance may be due to the speaker's casual and matter-of-fact tone in discussing the unusual situation from their wedding. The speaker's intention may be to share a humorous anecdote, while the listener's possible reaction of amusement or surprise could also contribute to the overall neutral emotion in the conversation."
"Honey, it isn?t good luck.",Mrs. Bing,neutral,neutral,39,neutral,"The reason for Mrs. Bing's neutral emotion could be due to her firm belief in the superstition of bad luck associated with the wedding tradition, despite Mr. Bing's attempt to argue against it."
Oh my God! Monica!,Ross,surprise,positive,39,surprise,"The emotion of surprise in Ross may be due to Monica's unexpected reaction or response, which may have caught him off guard based on the preUtterance of Mrs. Bing trying to comfort or reassure Monica."
"I know! Hey, how?s Chandler doin??",Monica,neutral,neutral,39,joy,The reason for the emotion of joy in this context is likely because Monica is excited to hear about Chandler's well-being and engage in a positive conversation with Ross.
Great. He?s doing great. Don?t you worry about Chandler.,Ross,neutral,neutral,39,joy,"The reason for the emotion of joy in Ross's utterance is likely because he is happy to report that Chandler is doing well, reassuring Monica and possibly easing her concerns."
Yeah baby!,Monica,joy,positive,40,joy,"The reason for Monica's joy in saying ""Yeah baby!"" could be that she is celebrating a success or victory, and the listener may react with shared excitement or congratulatory remarks."
"I?m really glad you guys are okay but, I just keep thinking what would happen if-if you two  actually had hooked up.",Phoebe,neutral,neutral,40,surprise,"The surprise emotion in Phoebe's utterance may be due to the unexpected thought of what could have happened if Monica and the other person had actually hooked up. This surprise could stem from a mix of curiosity, concern, and possibly even amusement."
"So, we did okay at the strip club, right?",Monica,neutral,neutral,41,neutral,The neutral emotion in this context may suggest that the speaker is unsure about their performance and is seeking feedback or validation from the listener. The listener may respond positively or provide constructive criticism to reassure the speaker.
"Oh yeah, that was great. Thanks to you, the hottest cocktail waitress there is quitting to teach the third grade!",Chandler,anger,negative,41,joy,"The emotion of joy in Chandler's utterance may be due to the satisfaction of causing a humorous or unexpected outcome at the strip club, as seen in Monica's reaction."
I can?t believe it! He still hasn?t called.,Rachel,anger,negative,41,anger,"The reason for Rachel's anger could be due to feeling frustrated and disappointed that the person she's waiting for hasn't called yet, leading to her expressing her emotions."
"Who, Josh?",Phoebe,surprise,negative,41,surprise,"The reason for the speaker's frustration or disappointment is likely because they were expecting Josh to call and he hasn't, leading to feelings of rejection or uncertainty. The listener may offer comfort or advice to help the speaker cope with their emotions."
It?s Joshua.,Rachel,anger,negative,41,anger,"The reason for Rachel's anger towards Joshua could be due to a past negative experience with him, such as betrayal or conflict. This could be inferred from the strong emotion displayed and Phoebe's curious inquiry about Joshua."
"What, he doesn?t like Josh?",Monica,surprise,negative,41,surprise,"The emotion of surprise in Monica may be due to the unexpected correction from Rachel about the correct name of Joshua. Monica's intention may have been to express confusion or curiosity about why someone doesn't like Joshua, leading to her surprise when corrected."
"No, I don?t.",Rachel,disgust,negative,41,disgust,"The reason for Rachel's disgust emotion could be that she is surprised or disappointed by the listener's lack of interest in Josh, as indicated by Monica's question. This lack of interest may go against Rachel's expectations or preferences, leading to her emotional response."
"All right, well I?m gonna put my sweats back on.",Chandler,neutral,neutral,41,neutral,The reason for Chandler's neutral emotion may be that he is simply stating his intention to put his sweats back on without any strong feelings attached to it.
Oh no!,Phoebe,surprise,negative,41,surprise,"The reason for Phoebe's surprise emotion may be due to Chandler's unexpected decision to put his sweats back on, which could have caught her off guard based on her previous expectations or assumptions."
Wait!,Phoebe,surprise,negative,41,surprise,"The reason for Phoebe's surprise in the current utterance ""Wait!"" may be due to unexpected information or a sudden change in the conversation, which could lead the listener to be curious or intrigued about what is happening next."
"Okay, y?know what, you were right, you were right.",Phoebe,sadness,negative,41,joy,"The reason for the joy emotion in this situation could be the speaker's realization of being wrong and admitting it, leading to a sense of relief and satisfaction. The listener may also feel validated or pleased by the speaker's admission."
"We really weren?t great at being guys, but you know why?",Phoebe,sadness,negative,41,joy,"The emotion of joy in the current utterance may be due to the speaker realizing and admitting their mistake, and the listener feeling validated by the admission."
Because we?re girls.,Phoebe,neutral,neutral,41,joy,"The emotion of joy in the utterance ""Because we're girls"" may be due to the speaker feeling a sense of camaraderie or empowerment in identifying with their gender, while the listener may also feel a sense of shared identity or understanding."
"Thank you, thanks.",Ross,joy,positive,42,joy,"Reason for the emotion of joy: Ross is feeling joy because he is expressing gratitude, which is likely to make the listener feel appreciated or acknowledged."
"Yeah, I lost it.",Ross,sadness,negative,42,sadness,"The sadness in Ross's current utterance may be due to the fact that he lost something important. The gratitude expressed in the preUtterance may have been a genuine expression of thanks for something, which could have elicited a positive response from the listener."
"Y?know, I?m not gonna play anymore,  would you, can you finish my set?",Ross,neutral,neutral,42,neutral,"The emotion of frustration or defeat may be due to the speaker feeling overwhelmed or unable to continue, leading them to ask for help or support from the listener."
"After that? Yeah! No, I mean if I can help.",Phoebe,surprise,positive,42,joy,"The reason for Phoebe's joy could be because she feels happy and willing to help Ross finish his set, showing her willingness to assist and support him."
"Yeah, like I could",Ross,neutral,neutral,42,neutral,"The reason for the neutral emotion in Ross's utterance could be that he is simply agreeing with Phoebe and showing understanding, without any strong emotional attachment to the conversation at that moment."
What?,Rachel,surprise,positive,42,surprise,"The reason for the emotion of surprise in Rachel's utterance could be due to Ross expressing doubt or skepticism in the preUtterance. This unexpected response may have caught Rachel off guard, leading to her surprise."
I played bad on purpose guys.,Ross,joy,positive,42,surprise,"The reason for Ross feeling surprised could be due to the unexpected and potentially confusing statement he made, which may have elicited shock or disbelief from the listener, Rachel."
"Okay, so you were trying to play bad this whole time.",Monica,surprise,positive,42,surprise,The reason for the surprise emotion in Monica could be due to the unexpected revelation from Ross that he was intentionally playing bad.
"Yeah?no, just that last song.",Ross,neutral,neutral,42,neutral,The reason for the neutral emotion in Ross's utterance could be that he was simply responding to Monica's comment without much emotion or attachment to the conversation.
"Oh, I was thinking about having people over for the game.",Monica,neutral,neutral,43,joy,The reason for the emotion of joy could be the speaker's excitement about the idea of hosting a gathering for the game and the listener's positive reaction to the invitation.
"Oh yeah, who?s playing?",Joey,neutral,neutral,43,neutral,The emotion of neutrality in Joey's utterance may indicate a lack of strong interest or enthusiasm in the conversation about having people over for the game. This could be because he is not particularly invested in the idea of attending the gathering or is simply indifferent to the topic being discussed.
The players.,Monica,neutral,neutral,43,neutral,"The neutral emotion in this context may be due to the speaker simply providing information about the players without any strong emotional attachment. The listener's possible reactions of asking for more details or showing interest may not elicit a strong emotional response from the speaker, leading to a neutral emotion."
Somebody seems to be missing being the hostess.,Ross,neutral,neutral,43,surprise,"The surprise emotion in Ross's utterance may be due to Monica's unexpected response or behavior, which could have caught him off guard."
"Please, it?s a relief is what it is, is what it is.",Monica,neutral,neutral,43,joy,"The reason for Monica's joy could be that she is relieved and happy to not be the hostess, possibly because it was a stressful or tiring role for her. This is supported by Ross' teasing comment about her missing being the hostess, indicating that Monica may have been feeling overwhelmed in that role."
"All right Pheebs, stick out your plate!",Joey,neutral,neutral,43,joy,The reason for Monica's expression of relief could be due to a sense of satisfaction or accomplishment from a previous situation. This emotion may be influenced by the listener's understanding or agreement with the situation that led to Monica's relief.
Oh.,Phoebe,neutral,neutral,43,neutral,The emotion of neutrality in Phoebe's response could be due to her not being particularly excited or interested in the offer of food from Joey. Her lack of a strong reaction could indicate a lack of strong feelings towards the situation.
Whose is it?,Chandler,neutral,neutral,44,neutral,The emotion of curiosity in this context is likely driven by the speaker's desire to gather information and clarify a specific point. The listener's potential reaction could involve providing the requested information or engaging in further discussion to address the speaker's curiosity.
I don?t want to say.,Rachel,neutral,neutral,44,neutral,"The speaker's emotion of neutrality may be due to wanting to keep a secret or withhold information, leading to potential frustration or curiosity from the listener."
"Oh, come on! I don?t care! Come on! Whose is it?",Chandler,joy,positive,44,joy,"The reason for Chandler's joy in this situation may be because he is excited and curious to find out whose it is, and he may be enjoying the playful teasing and pressure of trying to get Rachel to reveal the information."
Diane Keaton.,Rachel,neutral,neutral,44,neutral,"The speaker's frustration and impatience may be due to a desire for a quick resolution or answer, while the listener may feel pressured or annoyed by the speaker's persistence."
Phoebe! Come on! Let?s go!  Come on!  Why aren?t you dressed yet?!,Monica,anger,negative,45,surprise,"The speaker's surprise and impatience may be due to a sense of urgency or a time constraint, leading them to push the listener to hurry up and get dressed."
"I?m sorry, but I just wrote the best dance song for your wedding. Check this out.",Phoebe,neutral,neutral,45,joy,"The reason for Phoebe's joy in writing a dance song for the wedding could be due to her desire to contribute something special and meaningful to the event, as well as her excitement to share her creation with others."
"No, Phoebe, I?ll tell you what, if you get ready now I?ll let you play it at the wedding.",Monica,neutral,neutral,45,joy,The reason for the emotion of joy in Monica's utterance is likely because she is excited about the idea of Phoebe getting ready quickly and being able to play her dance song at the wedding. This shows that Monica values Phoebe's contribution and wants her to be a part of the special day.
Really?!,Phoebe,surprise,positive,45,surprise,The reason for Phoebe's surprise emotion is likely due to the unexpected offer from Monica to let her play something at the wedding as a reward for getting ready quickly.
Oh that?s so exciting!,Phoebe,joy,positive,45,joy,"The reason for the joy emotion in the current utterance may be due to the excitement expressed by the listener in the preUtterance, leading to a positive and enthusiastic response."
Thanks Mon!,Phoebe,joy,positive,45,joy,"The reason for the joy emotion in the current utterance is likely due to the speaker feeling grateful and appreciative towards the listener, as expressed in the preUtterance."
"Oh but Mon, if you touch my guitar again I?ll have to pound on you for a little bit.",Phoebe,anger,negative,45,anger,The reason for Phoebe's anger towards Monica touching her guitar again could be due to a sense of personal boundaries being crossed and a need to protect her belongings.
"Fair enough, now go get ready!",Monica,neutral,neutral,45,neutral,The reason for Phoebe's neutral emotion in the current utterance is likely because Monica's response was lighthearted and did not escalate the situation. Phoebe may have been anticipating a playful interaction and Monica's reaction aligned with that expectation.
"I?ll get everybody else , finally we can start celebrating my? I?m sorry, uh apparently I?ve opened the door to the past.",Monica,neutral,neutral,45,joy,The reason for the emotion of joy in the current utterance is likely due to the speaker's excitement about finally being able to start celebrating and the listener's anticipation for the upcoming celebration.
"My best shoes, so good to me.",Leslie,joy,positive,46,joy,The speaker's joy is likely due to feeling grateful for their shoes and the positive impact they have had on them. The listener's possible agreement or admiration for the shoes may further validate the speaker's feelings of joy.
I wear them everyday.,Leslie,joy,positive,46,joy,"The speaker's joy in wearing their shoes everyday likely stems from a sense of comfort, confidence, or style that the shoes provide. The positive reactions from the listener may further validate the speaker's emotional attachment to their shoes."
"Down at the heel, holes in the toes.",Leslie,joy,positive,46,sadness,"The reason for Leslie's sadness may be due to feeling overwhelmed or worn down by their current circumstances, as indicated by their description of their worn-out shoes. The listener's sympathy and potential offer of support may also contribute to Leslie's emotional response."
Don?t care what people say.,Leslie,joy,positive,46,anger,"The emotion of anger in Leslie's current utterance ""Don?t care what people say"" may be due to feeling fed up with criticism or judgment from others. The speaker's intention could be to assert their independence and confidence, while the listener may react with surprise or concern because Leslie is expressing a strong disregard for others' opinions."
"My feet?s best friends, pals to the end.",Leslie,joy,positive,46,joy,"The reason for the emotion of joy in Leslie's current utterance may be due to their strong sense of self and confidence in their choices, as expressed in their preUtterance. The positive reaction from the listener may also contribute to Leslie's joy."
With them I?m one hot chicky.,Leslie,joy,positive,46,joy,"The speaker's joy may be a result of feeling confident and playful in their interactions, as indicated by their intentions to portray themselves in a positive light. The listener's potential reactions of amusement or agreement may further contribute to the speaker's positive emotions."
"Though late one night, not much light, I....",Leslie,neutral,neutral,46,joy,The reason for the emotion of joy in the current utterance could be due to the speaker feeling playful and confident in the previous utterance. This sense of playfulness and confidence may have led to a positive and joyful mood in the speaker.
I stepped in something icky.,Phoebe,joy,positive,46,disgust,"The reason for Phoebe's disgust emotion could be due to stepping in something unpleasant or gross, which may lead to her expressing her discomfort to Leslie."
"Sticky shoes, sticky shoes, always make me smile. Sticky shoes, sticky shoes, next time I?ll.... avoid the..... pillleeeee.",Phoebe and Leslie,joy,positive,46,joy,"The emotion of joy in the current utterance ""Sticky shoes, sticky shoes, always make me smile..."" is likely a result of the speaker finding humor or amusement in the situation of having sticky shoes. The intention of the speaker may be to lighten the mood or make light of a potentially frustrating or annoying situation. The listener's possible reaction could be to join in the humor and share in the lightheartedness of the moment."
"God, it?s gonna so weird like when I come home and you?re not here.",Joey,sadness,negative,47,sadness,The reason for Joey's sadness could be the fear of feeling lonely or missing the presence of the listener when they are not home. Joey's intention to express this emotion and the listener's potential reaction of offering reassurance or comfort suggest that Joey values the listener's company and is anxious about being without it.
No more Joey and Chan?s.,Joey,sadness,negative,47,sadness,"The reason for Joey's sadness could be due to the impending separation from Chan, leading to feelings of loneliness and missing their presence. Joey's expression of how weird it will be without Chan suggests a strong emotional bond and dependency on their presence."
